id,date,text,cleaned
1361095059257499648,2021-02-14 23:28:44+00:00,"hey i'm val! 💖

🍄 oc artist, storyteller
🍄 nonbinary lesbian
🍄 rt heavy, can get political
🍄 art may contain: artistic nudity, blood/gore, body horror, self harm/suicide themes, etc

ℹ️ https://t.co/x8K1gO8Xff
💟 https://t.co/wRdhuhHaNq
💌 https://t.co/iFmVzmf8N0 https://t.co/6jDU8mevU1",hey val       oc artist  storyteller   nonbinary lesbian   rt heavy  political   art contain  artistic nudity  blood gore  body horror  self harm suicide theme  etc       x k xff     wrdhuhhanq     ifmvzmf     jdu mevu 
1361095037308837888,2021-02-14 23:28:39+00:00,"We did it boys.
We made it through Valentine's day without suicide.
Except Bartek 😿
R.I.P. Bartek 
🔄🇮🇩",boy  valentine day suicide  bartek   p  bartek     
1361095009689341954,2021-02-14 23:28:32+00:00,"Thinking about the family, friends &amp; fans of #CarolineFlack @carolineflack1 on the 1 year Anniversary tomorrow of her untimely death😔 suicide is so final &amp; heartbreaking- please reach out if you’re in a dark place @samaritans @MindCharity https://t.co/ZItjyr5m31",thinking family  friend  amp  fan  carolineflack  carolineflack    year anniversary tomorrow untimely death  suicide final  amp  heartbreaking  reach dark place  samaritan  mindcharity   zitjyr  
1361094950608232449,2021-02-14 23:28:18+00:00,"@mtv_law 

Blue Lives DON’T Matter . . . to Van Der Veen &amp; Senate Republicans who acquitted Trump of inciting insurrection.

Officer Brian Sicknick died from injuries sustained in the riot, and two other officers committed suicide.

GOP:  Get over it!

https://t.co/mdyoGlVDLm", mtv law   blue life matter       van der veen  amp  senate republican acquitted trump inciting insurrection   officer brian sicknick died injury sustained riot  officer committed suicide   gop       mdyoglvdlm
1361094944874586116,2021-02-14 23:28:17+00:00,"@CzebotarJessie Michel killed in avalanche. Carter Cooper maybe didn't commit suicide, and is now Cathy Griffin. Is Haim actually still alive?", czebotarjessie michel killed avalanche  carter cooper maybe didn commit suicide  cathy griffin  haim actually alive 
1361094863043907586,2021-02-14 23:27:57+00:00,@arcadefn U hit a horizontal can send suicide with the storm scout, arcadefn hit horizontal send suicide storm scout
1361094861030572034,2021-02-14 23:27:57+00:00,"cw // suicide 
-
-
-
- 
idc what someone one did you don’t ever tell them to kill themselves",cw    suicide           idc tell kill
1361094845645942795,2021-02-14 23:27:53+00:00,"My greatest hope for the covid era is that we finally come to recognize and appreciate our social interdependence as a species. 

My greatest fear is that an entire generation suffers an avalanche of suicide and life-long psychological tolls, and no one does anything about it.",greatest hope covid era finally come recognize appreciate social interdependence specie    greatest fear entire generation suffers avalanche suicide life long psychological toll  doe 
1361094845121593348,2021-02-14 23:27:53+00:00,"Part of me is like...you don’t know what went down in their relationship..but I’m also like...the girl was battling depression and suicide. Screw this new chick 😂😂

And the new chick looks TOTALLY diff than the baby momma 

I....",like   know went relationship  like   girl battling depression suicide  screw new chick     new chick look totally diff baby momma      
1361094833234989056,2021-02-14 23:27:50+00:00,"If you were presented with a button that when pressed meant that you never existed (not suicide) would you press it?
I'm NOT maudlin. I just objectively don't see the point in being around anymore.
If I were an alien, I'd head back to my planet &amp; eat frog spawn like baby yoda.",presented button pressed meant existed  suicide  press  maudlin  objectively point anymore  alien  d head planet  amp  eat frog spawn like baby yoda 
1361094784761270275,2021-02-14 23:27:39+00:00,@MINECRAFTCOCK HAPPY VALENTINES DAY ADAM !!!, minecraftcock happy valentine day adam    
1361094741031489537,2021-02-14 23:27:28+00:00,"@whiskygamer83 Blue Lives DON’T Matter . . . to Attorney Van Der Veen &amp; Senate Republicans who acquitted Trump of inciting insurrection.

Officer Brian Sicknick died from injuries sustained in the riot, and two other officers committed suicide.

GOP:  Get over it!

https://t.co/mdyoGlVDLm", whiskygamer   blue life matter       attorney van der veen  amp  senate republican acquitted trump inciting insurrection   officer brian sicknick died injury sustained riot  officer committed suicide   gop       mdyoglvdlm
1361094703551283205,2021-02-14 23:27:19+00:00,"Maybe @IMPACTWRESTLING offered @sammyguevara to become the new Suicide. If that's the case, I don't blame him. 😂",maybe  impactwrestling offered  sammyguevara new suicide  case  blame   
1361094667937452034,2021-02-14 23:27:11+00:00,"I used to be tripping, 8th Street graffiti crew
After 18, it is as old as 70, which are ancient days
17-year-old suicide me, the most sensuous lover ever. 

#amwriting #poem",tripping   th street graffiti crew     old     ancient day    year old suicide  sensuous lover     amwriting  poem
1361094585154494469,2021-02-14 23:26:51+00:00,@EvolutionPod @gfdedwards 🇯🇵 😱 2001 suicide club. 2008 Tokyo gore police. 2015 tag, evolutionpod  gfdedwards           suicide club       tokyo gore police       tag
1361094578716213255,2021-02-14 23:26:50+00:00,"- self-harm or lash out. 

I don't condone suicide baiting, at all, I'm not going to encourage people to hurt themselves no matter how much I hate this, but I'm starting to grow admittedly suspicious with this pattern of behavior. 

Either way, it's time for Blake to get off.",  self harm lash    condone suicide baiting   going encourage people hurt matter hate  starting grow admittedly suspicious pattern behavior    way  time blake 
1361094568783974400,2021-02-14 23:26:47+00:00,"""I've been contemplating suicide, but it really doesn't suit my style."" https://t.co/RD4kiasCVO", contemplating suicide  doesn suit style     rd kiascvo
1361094358490116101,2021-02-14 23:25:57+00:00,"Tomorrow On The News: Saddened Father Is Apathetic Towards Suicide Victims, Coming Up At 5",tomorrow news  saddened father apathetic suicide victim  coming  
1361094354576625667,2021-02-14 23:25:56+00:00,"@SupFletcher @ScottKaplan I guess your motive is to increase childhood depression and suicide in San Diego, because that is exactly what you’re doing! Also, you are taking away college opportunities away from our youth as well! Shame on you!", supfletcher  scottkaplan guess motive increase childhood depression suicide san diego  exactly   taking away college opportunity away youth  shame 
1361094347375132673,2021-02-14 23:25:54+00:00,@Mindful_Jedi Ahh. I wasn’t a fan of Leto joker either in the suicide squad and that was before I knew Leto was a cult leader. 🤡, mindful jedi ahh  wasn fan leto joker suicide squad knew leto cult leader   
1361094335429763075,2021-02-14 23:25:52+00:00,"@MelaniaBarronUS ...TO THE POINT THEY LOSE THEIR HOMES!! CHILDREN...AND I MEAN CHILDREN THE AGES OF 12, 11, 19, 18, MORE SO...12, 11, ARE COMMITTING SUICIDE BECAUSE OF THIS N.EFARIOUS W.ORLD O.RDER O.PRESSION! AND YOU DARE SPEAK TO US THAT WAY! WHOEVER YOU ARE, GO FK USELF!", melaniabarronus    point lose home   child   mean child age                           committing suicide efarious w orld o rder o pression  dare speak way   fk uself 
1361094301166501896,2021-02-14 23:25:43+00:00,@MsaMkhize_ What a suicide mission 😭, msamkhize  suicide mission  
1361094288235454465,2021-02-14 23:25:40+00:00,"@RussellHFilm @C_A_Huggins Really, it would have been less costly to let him do his 3-3.5 hour cut in the long run. Instead they have a first version that was received even more poorly than the previous two films (BvS &amp; Suicide Squad) and set up a rather painful discourse for three years.", russellhfilm  c huggins  le costly let       hour cut long run  instead version received poorly previous film  bvs  amp  suicide squad  set painful discourse year 
1361094280316669957,2021-02-14 23:25:38+00:00,"@joncoopertweets All those officers affected!! Wounds, death, suicide. Died defending the very people who bragged about being acquitted.", joncoopertweets officer affected   wound  death  suicide  died defending people bragged acquitted 
1361094264973893635,2021-02-14 23:25:35+00:00,I'm beginning to think that it was either an assisted suicide or an encouraged suicide. She suffered from bipolar disorder and I know first hand how deep those manic episodes can get. Maybe she met someone who encouraged her to do it? That would also explain the closed hatch.,beginning think assisted suicide encouraged suicide  suffered bipolar disorder know hand deep manic episode  maybe met encouraged  explain closed hatch 
1361094152050597889,2021-02-14 23:25:08+00:00,"@redbeard36 @axios @VP @mikeallen Big picture? If these idiots were in charge at the beginning there’d be a million dead from Covid, Tens of thousands dead from suicide and a bankrupt economy.", redbeard    axios  vp  mikeallen big picture  idiot charge beginning d million dead covid  thousand dead suicide bankrupt economy 
1361094119771242498,2021-02-14 23:25:00+00:00,"#SuicidePrevention 1 of 2 people who died from #suicide saw a doctor in prior 30 days, https://t.co/CCpSjfPxv2, please screen all your patients: https://t.co/ByQFbpRC42 #SharedFacts", suicideprevention     people died  suicide saw doctor prior    day    ccpsjfpxv   screen patient    byqfbprc    sharedfacts
1361094109520396289,2021-02-14 23:24:58+00:00,"On 30 June 1996 a suicide bombing targeting a group of 60unarmed military personnl perpetrated by PKK occurred in Tunceli, killing 8people and injuring 29others

On 29 October 1996 a suicide bombing occurred in Sivas and killed 6people including a civilian while injuring 10others",   june      suicide bombing targeting group   unarmed military personnl perpetrated pkk occurred tunceli  killing  people injuring       october      suicide bombing occurred siva killed  people including civilian injuring  
1361094098527092737,2021-02-14 23:24:55+00:00,"On average suicide hotlines receive an additional 200 calls on valentines day.

Please tell someone you love them today.",average suicide hotlines receive additional     valentine day   tell love today 
1361094094542503939,2021-02-14 23:24:54+00:00,"he rests his head back against the couch cushion, staring silently up at melone.

“listen..
it’s okay. we didn’t plan enough. i sent everyone on a suicide mission, melone. i’m so.. sorry.” https://t.co/Eg8UCTDCyD",rest head couch cushion  staring silently melone    listen   okay  didn plan  sent suicide mission  melone    sorry     eg uctdcyd
1361094064272257035,2021-02-14 23:24:47+00:00,@TheEnervator @k1482 @Swiss_Danny_67 @Mark_J_Harper Suicide and self harm rates in 2020 were lower than previous years and five year average - including significant falls in each lockdown, theenervator  k      swiss danny     mark j harper suicide self harm rate      lower previous year year average   including significant fall lockdown
1361094062711795712,2021-02-14 23:24:47+00:00,"@kingsrush Blue Lives DON’T Matter . . . to Attorney Van Der Veen &amp; Senate Republicans who acquitted Trump of inciting insurrection.

Officer Brian Sicknick died from injuries sustained in the riot, and two other officers committed suicide.

GOP:  Get over it!

https://t.co/mdyoGlVDLm", kingsrush blue life matter       attorney van der veen  amp  senate republican acquitted trump inciting insurrection   officer brian sicknick died injury sustained riot  officer committed suicide   gop       mdyoglvdlm
1361094061428379649,2021-02-14 23:24:46+00:00,@MadPharmacist1 You don't need to speak French to know that suicide's more complex than being in 'lockdown'., madpharmacist  need speak french know suicide complex  lockdown  
1361094053383852032,2021-02-14 23:24:44+00:00,"On the 20th, it will be 1 year since my last suicide attempt.",  th    year suicide attempt 
1361094032059998211,2021-02-14 23:24:39+00:00,"Thanks to those who reached out to me today, it's crazy how you say suicide &amp; people real life jus scroll on",thanks reached today  crazy suicide  amp  people real life jus scroll
1361094001949048837,2021-02-14 23:24:32+00:00,"19% of cyber bullying victims commit suicide.

1(800)273-8255",    cyber bullying victim commit suicide                 
1361093968944062471,2021-02-14 23:24:24+00:00,"The good ending, suicide at 25. The bad ending, living to beyond 70.",good ending  suicide     bad ending  living    
1361093964875649026,2021-02-14 23:24:23+00:00,@MsRebeccaBlack @westonallen64 @DORIANELECTRA @bigfreedia @3OH3 suicide is poggers, msrebeccablack  westonallen    dorianelectra  bigfreedia   oh  suicide poggers
1361093927722442753,2021-02-14 23:24:14+00:00,@onllwyn @neiljmcevoy @GymraesY @swpolice And what if those laws are driving people to social and financial devastation and then to suicide ?, onllwyn  neiljmcevoy  gymraesy  swpolice law driving people social financial devastation suicide  
1361093922127106054,2021-02-14 23:24:13+00:00,"@lilmonix3 Heya...... totally i just seen your look-a-like on tiktok and.......shes post suicide stuff like self harming.....
I need help, my brother killed himself ._.
Hes actually hanging there", lilmonix  heya       totally seen look like tiktok       shes post suicide stuff like self harming      need help  brother killed     actually hanging
1361093875079733248,2021-02-14 23:24:02+00:00,//. Suicide Squad and Justice League roleplayers are all welcome!,    suicide squad justice league roleplayers welcome 
1361093868540805126,2021-02-14 23:24:00+00:00,@Ironmarc1 @IGN Yeah I've seen suicide squad I would have to see for myself, ironmarc   ign yeah seen suicide squad
1361093861708345347,2021-02-14 23:23:59+00:00,"@DeadpoolComrade Also, I will still remember how they called people sexist over not wanting to watch Ghostbusters 2016 or getting an artist almost committed suicide cause he draw this one character from Steven Universe a bit slimmer than in the show.", deadpoolcomrade  remember called people sexist wanting watch ghostbusters      getting artist committed suicide cause draw character steven universe bit slimmer 
1361093847254769670,2021-02-14 23:23:55+00:00,@bridgingsuplex @slamwrestling @CultIcon @sammyguevara I will jump in now on a personal level. I hate click bait sites too. This happened to be a story that seemed like that. But the column @JamieHemmings1 just delivered on the suicide of Tom Cole is much more about what @slamwrestling represents. https://t.co/iEz4lOv9eX, bridgingsuplex  slamwrestling  culticon  sammyguevara jump personal level  hate click bait site  happened story like  column  jamiehemmings  delivered suicide tom cole  slamwrestling represents    iez lov ex
1361093840074113024,2021-02-14 23:23:54+00:00,"tw // suicide , rape
-
-
-
-
-
would y’all act like this if a real girl k!lled herself due to rape and being known as a slut ... https://t.co/h7qbwIw1tX",tw    suicide   rape           act like real girl k lled rape known slut       h qbwiw tx
1361093837033263104,2021-02-14 23:23:53+00:00,Oh No! Pretty Lady Commits Suicide After She Allegedly Caught Her Husband In Bed With Another Woman https://t.co/zspes1Fk0W,oh  pretty lady commits suicide allegedly caught husband bed woman   zspes fk w
1361093833363177475,2021-02-14 23:23:52+00:00,"pedophilia // (also kinda suicide baiting LULW)
.
.
.
.
if ur a legal adult in the nsfwmcyttwt community and you talk to any of the minors in that community you should ky$",pedophilia     kinda suicide baiting lulw          ur legal adult nsfwmcyttwt community talk minor community ky 
1361093828120223746,2021-02-14 23:23:51+00:00,@FriendsOScience suicide #children https://t.co/R1BFoTwE8Q, friendsoscience suicide  child   bfotwe q
1361093732364353538,2021-02-14 23:23:28+00:00,@daddy_j86 @sp33dy117 @CultureCrave @VanityFair The time he was joker In suicide squad and now the trailer, daddy j    sp      culturecrave  vanityfair time joker suicide squad trailer
1361093704346267648,2021-02-14 23:23:21+00:00,"Had a conversation with a doctor today, questioned the lockdown and everything. He got angry and said its real and saves lives. I mentioned a lot of lives getting ruined and people committing suicide, he said it cant be perfect. Apparently not all lives are important to doctors.",conversation doctor today  questioned lockdown  got angry said real save life  mentioned lot life getting ruined people committing suicide  said cant perfect  apparently life important doctor 
1361093671840481280,2021-02-14 23:23:13+00:00,@AnnCoulter The hundreds that die by suicide or domestic abuse by a homeowners’s gun doesn’t get reported. This is an anomaly. That is why it is news., anncoulter die suicide domestic abuse homeowner gun doesn reported  anomaly  news 
1361093611983568896,2021-02-14 23:22:59+00:00,"@polguru @jaketapper He could stop getting in the business of transgender children in a state where suicide amongst lgbt youth is sky high imo . Like yes I appreciate he’s not a facist but that doesn’t mean he’s a person of great integrity, he’s just not a facist. Can we pick the bar up off the floor", polguru  jaketapper stop getting business transgender child state suicide lgbt youth sky high imo   like yes appreciate facist doesn mean person great integrity  facist  pick bar floor
1361093595483279361,2021-02-14 23:22:55+00:00,"They have outright told someone that if people keep holding them accountable to this it will push them to suicide and that is a disgusting, manipulative thing to say

They are not sorry, they just don't want to be held accountable for their disgusting actions",outright told people holding accountable push suicide disgusting  manipulative thing  sorry  want held accountable disgusting action
1361093484216610816,2021-02-14 23:22:29+00:00,"@batwomanfl @SenateGOP @GOP Blue Lives DON’T Matter . . .

. . . to Rob Portman &amp; Senate Republicans who acquitted Trump of inciting insurrection.

Officer Brian Sicknick died from injuries sustained in the riot, and two other officers committed suicide.

Portman:  Get over it!

https://t.co/mdyoGlVDLm", batwomanfl  senategop  gop blue life matter              rob portman  amp  senate republican acquitted trump inciting insurrection   officer brian sicknick died injury sustained riot  officer committed suicide   portman       mdyoglvdlm
1361093425408471043,2021-02-14 23:22:15+00:00,"@iyagovos Oh, not really scary like that. It deals with some heavy subject matter—like suicide—but otherwise, it's somewhat of a more adult magical girl show.", iyagovos oh  scary like  deal heavy subject matter like suicide  somewhat adult magical girl 
1361093415946059776,2021-02-14 23:22:12+00:00,"// suicide 
.
.
.
yeah , and then after convincing them to stay and writing paragraphs and crying , then going back into your bed and thinking the exact same dark thoughts . its a cycle https://t.co/CmQ2AenqrZ",   suicide        yeah   convincing stay writing paragraph cry   going bed thinking exact dark thought   cycle   cmq aenqrz
1361093397948358656,2021-02-14 23:22:08+00:00,I’m really happy that Jared Leto is getting another shot at playing The Joker. The guy is super talented. And I was always intrigued by the little bit of him we got in Suicide Squad. Didn’t love everything of course and some of his lines sucked but I was always interested,happy jared leto getting shot playing joker  guy super talented  intrigued little bit got suicide squad  didn love course line sucked interested
1361093394618023939,2021-02-14 23:22:07+00:00,//tw suicide mention in the second image https://t.co/1PkSwlimcd,  tw suicide mention second image    pkswlimcd
1361093329090473984,2021-02-14 23:21:52+00:00,"Not a chance in hell. Too bad they have years to be primaried. They need to be removed, or retire NOW. Include McConnell in that bunch. The GOP committed suicide on 1/6. #MAGAFOREVER https://t.co/fW9iql6V39",chance hell  bad year primaried  need removed  retire  include mcconnell bunch  gop committed suicide       magaforever   fw iql v  
1361093285457104899,2021-02-14 23:21:41+00:00,Know what I want to see? The guy who directed/produced BatmanVSuperman and Suicide Squad’s version of Justice League which was so bad that WB executives scrapped it and then replaced the guy with another guy who improved it to being just a dumpster fire from movie abomination. 👍,know want  guy directed produced batmanvsuperman suicide squad version justice league bad wb executive scrapped replaced guy guy improved dumpster fire movie abomination   
1361093274023333890,2021-02-14 23:21:39+00:00,"@Kinysis It uses to make me feel terrible when I worked at a youth centre years ago, how many homeless *kicked out of the house* lgbt teens there were, in and out of hospital on various suicide attempts. I do often wish we could do more collectively", kinysis feel terrible worked youth centre year ago  homeless  kicked house  lgbt teen  hospital suicide attempt  wish collectively
1361093265135525891,2021-02-14 23:21:36+00:00,@MichelsTristan I agree. I'm also not excited for the Snyder cut. I'm way more excited for James Gunn's The Suicide Squad., michelstristan agree  excited snyder cut  way excited james gunn suicide squad 
1361093238011142146,2021-02-14 23:21:30+00:00,Why are vets committing suicide?  Perhaps that issue should be addressed. https://t.co/I4LGN7H2aK,vet committing suicide   issue addressed    lgn h ak
1361093165537705985,2021-02-14 23:21:13+00:00,"@briansm20193481 As someone married to an alcoholic who has had multiple suicide attempts I can sympathise with both sides.  Not fault of girlfriend,  think much more complex and I'm always told I don't understand.  Difficult to live with  someone who spends all their money on  drink.", briansm         married alcoholic multiple suicide attempt sympathise   fault girlfriend   think complex told understand   difficult live  spends money  drink 
1361093158122127361,2021-02-14 23:21:11+00:00,More dumb covid nonsense. Kids are committing suicide from covid restrictions and idiots in charge are setting up ridiculous protocols. https://t.co/3O4369nGO3,dumb covid nonsense  kid committing suicide covid restriction idiot charge setting ridiculous protocol     o    ngo 
1361093149981102084,2021-02-14 23:21:09+00:00,"It's 2007, H.I.M's Dark Light album is still blasting through our earphones.
Me and my high school friends decide it's of utmost importance to sign a suicide pact that if Ville Valo dies of lung cancer, we too must end our 14 y/o lives.",      h dark light album blasting earphone  high school friend decide utmost importance sign suicide pact ville valo lung cancer  end    o life 
1361093102627409922,2021-02-14 23:20:58+00:00,"TW suicide
.
.
.
.
IS SOMETHING GOING ON WITH MY ZODIAC OR SUM LIKE I HATE EVERYTHING ABT ME RN AND I WANNA KMS AND I HATE IT SO MUCH😩 https://t.co/9LeKOsiXOV",tw suicide         going zodiac sum like hate abt rn wanna km hate     lekosixov
1361093089293647877,2021-02-14 23:20:55+00:00,"@heymrsbond I wrote out a 15 tweet stream breaking down all their arguments (increased suicide, CDC guidelines, using poor minority kids etc.) I deleted the whole thing because I didn't want to spend my Sunday arguing with nasty people, so thank you for doing this!!!!", heymrsbond wrote    tweet stream breaking argument  increased suicide  cdc guideline  poor minority kid etc   deleted thing didn want spend sunday arguing nasty people  thank    
1361093080527622144,2021-02-14 23:20:52+00:00,"Fuck Republicans, fuck @SpeakerPelosi and fuck your stupid politics. People’s lives are not a game. People have committed suicide over what happened on Jan. 6th. There is no healing without accountability. You guys suck. https://t.co/7fRhoXmAVS",fuck republican  fuck  speakerpelosi fuck stupid politics  people life game  people committed suicide happened jan   th  healing accountability  guy suck     frhoxmavs
1361093037108072449,2021-02-14 23:20:42+00:00,"A detective who uses his deductive powers to corner a suspect &amp; then does nothing tos stop them for commiting suicide, is no better than murderer himself",detective deductive power corner suspect  amp  doe tos stop commiting suicide  better murderer
1361093024906846209,2021-02-14 23:20:39+00:00,"tw // mentions of suicide

Let's double su1cid3 together! — You  are so weird god bles 🙏  https://t.co/HJCVgctSqF",tw    mention suicide  let double su cid      weird god bles      hjcvgctsqf
1361093022348283906,2021-02-14 23:20:39+00:00,"Creeped out by @afterdarkph latest episode on the Blue Whale Suicide challenge. Quick, someone give me something else to listen to!",creeped  afterdarkph latest episode blue whale suicide challenge  quick  listen 
1361093013397716995,2021-02-14 23:20:36+00:00,"On 10.5.2016 3people were killed and 33civilians and 12police officers were injured in a bombing in Diyarbakır perpetrated by PKK members who targeted an armored police vehicle

On 13.3.2016 a member of the TAK carried out a suicide attack in Ankara, killing more than 37civilians",           people killed   civilian   police officer injured bombing diyarbak perpetrated pkk member targeted armored police vehicle            member tak carried suicide attack ankara  killing   civilian
1361092936096702468,2021-02-14 23:20:18+00:00,@AndyArtoria @IGN Harley in suicide squad was awsome but birds of prey was such a dissapotment, andyartoria  ign harley suicide squad awsome bird prey dissapotment
1361092906384293896,2021-02-14 23:20:11+00:00,@DonaldJTrumpJr Please don't have me commit suicide, donaldjtrumpjr commit suicide
