id,date,text,cleaned
1361062094146318336,2021-02-14 21:17:45+00:00,"I have no Valentine again this year. Hopefully before life ends, I’ll be able to have one and be happily in love. That I’d love to experience.

However, I’m blessed to have amazing women in my life I love dearly: my mom, @midnightime23 , @FeliciaRose , &amp; @bethanneharms . 🥰💕🙏🏻 https://t.co/yFTeBMCszI",valentine year  hopefully life end  able happily love  d love experience    blessed amazing woman life love dearly  mom   midnightime      feliciarose    amp   bethanneharms          yftebmcszi
1361062037305106433,2021-02-14 21:17:31+00:00,"@LidsRodney RIGHT? 

I'm at the point in my life that if I ever find someone who will accept me as me, I will want to settle down and exist with them til the end.

Not that I think this is gonna be a thing, but if it does happen, boring will be good! Boring is dependable.", lidsrodney right    point life find accept  want settle exist til end   think gonna thing  doe happen  boring good  boring dependable 
1361061513574899712,2021-02-14 21:15:26+00:00,@cdeanrosedaviss @Onelovejadee Well I might end up losing my job because my life isn’t worth that job 😂 there’s more places to serve at!!!, cdeanrosedaviss  onelovejadee end losing job life isn worth job   place serve   
1361061269671997440,2021-02-14 21:14:28+00:00,"my life ends today with this video. 
 https://t.co/lytMJ3hdQ5",life end today video      lytmj hdq 
1361060764501606402,2021-02-14 21:12:28+00:00,"God, You are always worthy of my praise! I am so in awe of You. For the rest of my life, help me to begin and end each day by giving You the praise You deserve because You have done great things, and all glory belongs to You alone. Amen. https://t.co/lDvDCWBEz2",god  worthy praise  awe  rest life  help begin end day giving praise deserve great thing  glory belongs  amen    ldvdcwbez 
1361060612604715010,2021-02-14 21:11:51+00:00,"During my cock surgery there were major complications, and I briefly died. I could see a light and a figure at the end, it was god. “Lord, are Man united a banter club” I asked “Yes, my child” he responded.After he said that my heart rate picked up. Craziest experience of my life",cock surgery major complication  briefly died  light figure end  god   lord  man united banter club  asked  yes  child  responded said heart rate picked  craziest experience life
1361060525375959041,2021-02-14 21:11:31+00:00,@laynebruce @ktumulty I literally have stalkers who want to end my life., laynebruce  ktumulty literally stalker want end life 
1361060327526461449,2021-02-14 21:10:44+00:00,"i don’t see myself as religious at all anymore but i still have nightmares that even though i’m living my life as a decent person i’ll still end up in hell, and my mom constantly telling me that her biggest fear is that i’m no longer a christian doesn’t help me at all 🙃",religious anymore nightmare living life decent person end hell  mom constantly telling biggest fear longer christian doesn help  
1361059566088310788,2021-02-14 21:07:42+00:00,"saw a flattykawa joke today. i will end my life , im not like those other bitches",saw flattykawa joke today  end life   im like bitch
1361059557275930625,2021-02-14 21:07:40+00:00,@charlidamelio Hey I love you Charli you are such a inspiration to me you made my life better when I was gonna end it 🥺ily, charlidamelio hey love charli inspiration life better gonna end  ily
1361059143969349638,2021-02-14 21:06:01+00:00,"My life is going to change in the next couple months and I’m so ready for it, probably end up going MIA. But it’s okay I’ll always be back 😽",life going change couple month ready  probably end going mia  okay  
1361059006467473412,2021-02-14 21:05:29+00:00,@bothgoats I was once happy in my life to talk to an Footballing expert just to get trolled at the end😐, bothgoats happy life talk footballing expert trolled end 
1361058692079226889,2021-02-14 21:04:14+00:00,"@nmcinroy I want it to end, end of, no politics, no scaremongering, just my life back. I am not wealthy, I have a mother who’s amputee aged 85 . I want to go for lunch on a Sunday while I push her in the wheelchair. You know little things like that, they really matter to me and mother", nmcinroy want end  end  politics  scaremongering  life  wealthy  mother amputee aged      want lunch sunday push wheelchair  know little thing like  matter mother
1361058593341079558,2021-02-14 21:03:50+00:00,"At the end of my birthday I would like to say Thank you guys for everything I felt all your feelings for me and Thank you for being in my life I’m so so lucky to have you guys and  Actually you All made my day I’m happy because of you guys , i love you all :( !!",end birthday like thank guy felt feeling thank life lucky guy  actually day happy guy   love      
1361058384670126080,2021-02-14 21:03:00+00:00,"@MJMcKean @casspa Oh Mama I’m in fear for my life from the long arm of the law,
Lawman has put an end to my running and I’m so far from my home...🎼", mjmckean  casspa oh mama fear life long arm law  lawman end running far home    
1361057973481660416,2021-02-14 21:01:22+00:00,i would dead ass end my life today if it wasn’t for my child. just say a quick prayer for me..,dead end life today wasn child  quick prayer  
1361057920360861698,2021-02-14 21:01:10+00:00,"Sadness is to meet you in the crowd of days, weave with you the most beautiful stories of my life, and live them with all their details, then the story ends with a tragedy, like every story of my life.",sadness meet crowd day  weave beautiful story life  live detail  story end tragedy  like story life 
1361057852425719809,2021-02-14 21:00:53+00:00,FUCKING END MY LIFE,fucking end life
1361057678529822727,2021-02-14 21:00:12+00:00,"happy valentine my life ❤️❤️❤️❤️.
Before it ends https://t.co/kQFn887nhI",happy valentine life           end   kqfn   nhi
1361057417002446850,2021-02-14 20:59:10+00:00,12 hour shift on valentine’s day. please end my life.,   hour shift valentine day  end life 
1361057388237885442,2021-02-14 20:59:03+00:00,*unless sorin ends up hating this and then my life is over, sorin end hating life
1361057207463284743,2021-02-14 20:58:20+00:00,"Politicians are not afraid of comedians, they are afraid of audiences laughing at his political jokes
I used to think tht my life was a tragedy, but now I realize, it’s a comedy- Munawar Faruqui
End is amazing!

Munawar Faruqui Leaving Comedy https://t.co/JmE5TYmfLu via @YouTube",politician afraid comedian  afraid audience laughing political joke think tht life tragedy  realize  comedy  munawar faruqui end amazing   munawar faruqui leaving comedy   jme tymflu  youtube
1361056807318396942,2021-02-14 20:56:44+00:00,"@celtics During my cork surgery there were major complications, and I briefly died. I could see a light and a figure at the end, it was God.""Lord are the Celtics a shit franchise?"" I asked, ""yes my son"" He responded.After He said that my heart rate picked up.Craziest experience of my life", celtic cork surgery major complication  briefly died  light figure end  god  lord celtic shit franchise   asked   yes son  responded said heart rate picked craziest experience life
1361056629983219712,2021-02-14 20:56:02+00:00,before this special day ends I want to tell u that I love u more than myself I live for u u really are all I have I am lucky to have someone like you in my life I hope u stay healthy and happily ever my soulmate - https://t.co/S4D2jCXDUd,special day end want tell love live lucky like life hope stay healthy happily soulmate     d jcxdud
1361056299908268037,2021-02-14 20:54:43+00:00,i have done some really crazy shit in my life time and i end up breaking my tibia and fibula with a possible 3rd fracture slipping on fcking ice.,crazy shit life time end breaking tibia fibula possible  rd fracture slipping fcking ice 
1361055980361043974,2021-02-14 20:53:27+00:00,@City_Xtra If mr whippy is injured i might aswell end my life right here, city xtra mr whippy injured aswell end life right
1361055790719762433,2021-02-14 20:52:42+00:00,"Like it’s been years now i could actually tell the story that nearly changed my life ....... and i’m just now figuring it all out , at first i could tell it , i could tell you for beginning to the end now that’s how long it took me to except it",like year actually tell story nearly changed life         figuring   tell   tell beginning end long took
1361055740614635522,2021-02-14 20:52:30+00:00,"My 6 year old: Is Zelda a kid’s game?!

Me: THEY SAID IT WAS AND IT RUINED MY LIFE! I SPENT MY PRE TEEN YEARS TRYING TO BEAT IT. DONT PLAY IT! YOU’LL END UP LIKE ME!

Her: You can’t just say no?",  year old  zelda kid game     said ruined life  spent pre teen year trying beat  dont play  end like    
1361055722973274116,2021-02-14 20:52:26+00:00,@_NihilNovi_ no you didn’t stop that’s so cute pls :’) ily you’ll always be an important person in my life and if u EVER leave me without a goodbye i will cry for weeks on end,  nihilnovi  didn stop cute pls     ily important person life leave goodbye cry week end
1361055419687342080,2021-02-14 20:51:13+00:00,@BlackKnight10k I'm 60. I'm always one birthday away from the end of my life., blackknight  k     birthday away end life 
1361055006158434308,2021-02-14 20:49:35+00:00,@rich_energy Well that was the most wasted 2mins &amp; 14 seconds of my life. In the end there was no announcement &amp; just rambling so-called accomplishments that were really nothing to be proud about 🤦🏼‍♀️, rich energy wasted  min  amp     second life  end announcement  amp  rambling called accomplishment proud      
1361054369848901635,2021-02-14 20:47:03+00:00,"@OttawaCitizen 
October/2/2004, The Vatican church, Jewish Canadian and Government of Canada decided to end this investigation my life injustice way.Please see my U.N .Case the deal (2004 Niagara Falls, Ont,) between Vatican church and Government Canada. See the Justice CANADA.", ottawacitizen  october         vatican church  jewish canadian government canada decided end investigation life injustice way  case deal       niagara fall  ont   vatican church government canada  justice canada 
1361054107302305796,2021-02-14 20:46:01+00:00,"@makeyouhowell @ZZevre @Asianjunkies_ I hear you

For me, when every piece could be our last, each is as important as the one before, and my life’s work will be the whole story - how ever abruptly it may or may not come to an end", makeyouhowell  zzevre  asianjunkies  hear   piece  important  life work story   abruptly come end
1361053364721758212,2021-02-14 20:43:03+00:00,"https://t.co/uuABIzFQKH via @pinterest 
First of a series of videos dedicated to the women of Michael Jackson's life.... THE LADY IN MY LIFE COLLECTION.
The video ends with a tribute to Benjamin Keough.*Son Lisa Marie .....(video &amp; comment By Xyana ❤️",  uuabizfqkh  pinterest  series video dedicated woman michael jackson life     lady life collection  video end tribute benjamin keough  son lisa marie       video  amp  comment xyana   
1361053336695316480,2021-02-14 20:42:57+00:00,I would prefer my life end like Tesla rather than Edison.,prefer life end like tesla edison 
1361053333176414208,2021-02-14 20:42:56+00:00,"@Chabby_The_Kid End it 
I have nothing to lose at this point in my life 😂
All the best and good night 🤗", chabby kid end  lose point life   best good night  
1361053146605375496,2021-02-14 20:42:11+00:00,"MARC MEETS JAMIE J, THE LOVE OF MY LIFE

My friends call me Marc. It was the year 1994/95. I was coming to the end of a 20-year military career and I had lived all those years in the closet

https://t.co/Kshd8jFqF4 https://t.co/Hdlw7acZp7",marc meet jamie j  love life  friend marc  year          coming end    year military career lived year closet    kshd jfqf    hdlw aczp 
1361052599718305792,2021-02-14 20:40:01+00:00,"@BiiFieri I let my self worth problems get in the way of most of the things in my life, including relationships. I also always end up tying my value as a person to whether a relationship has success, and because it's so novel and I put so much pressure on it they end poorly for everyone", biifieri let self worth problem way thing life  including relationship  end tying value person relationship success  novel pressure end poorly
1361052110935228421,2021-02-14 20:38:05+00:00,""" In two days. This is where everything will finally end, even If I lose my life in the process...It doesn't matter."" https://t.co/XRmH3pewzt",  day  finally end  lose life process   doesn matter     xrmh pewzt
1361052074390257672,2021-02-14 20:37:56+00:00,atay till the end of my life. https://t.co/n3O0Lulm26,atay till end life    o lulm  
1361052034288525313,2021-02-14 20:37:46+00:00,"@RichardBurgon @johnelalamo Stop it, End of April people who make up 90% of hospitisations will have had at least one jab, and we will be moving to summer. We have to get back to normal. I don't believe spending my life in my living room is a reasonable expectation of the future.", richardburgon  johnelalamo stop  end april people     hospitisations jab  moving summer  normal  believe spending life living room reasonable expectation future 
1361051968156893184,2021-02-14 20:37:30+00:00,Wake me up when my life ends.,wake life end 
1361051926696108033,2021-02-14 20:37:21+00:00,kim taehyung.............. end my life,kim taehyung               end life
1361051903468195845,2021-02-14 20:37:15+00:00,megan thee stallion saved my life shes the cure for cancer she singlehandedly will put an end to the virus and shes gonna save the economy,megan thee stallion saved life shes cure cancer singlehandedly end virus shes gonna save economy
1361051839614050309,2021-02-14 20:37:00+00:00,"so if you've got to spend your time, won't you spend it with me?
i hope we kiss goodnight, it might just end my life, but if you think that it's right, i hope we kiss goodnight.",got spend time  won spend  hope kiss goodnight  end life  think right  hope kiss goodnight 
1361051826242662401,2021-02-14 20:36:57+00:00,@lexiellejensen @Shortney_Cass Someone plz just end my life bc wtf, lexiellejensen  shortney plz end life bc wtf
1361051612442210308,2021-02-14 20:36:06+00:00,This is the love of my life. My Dearest hubby Sonny.. Happy Valentine day baby. I will love you til  the end of time https://t.co/Zmy9qhfyAH,love life  dearest hubby sonny   happy valentine day baby  love til  end time   zmy qhfyah
1361051531513126912,2021-02-14 20:35:46+00:00,I PULLED THE JADE SWORD INSTEAD OF THE JADE SPEAR SOMEONE END MY LIFE AAAAAAAAAAAAAAAAAAAAAAAAAAAAAAAAAAAAAAAAAAAAAAAAAAAAAAAAA /NEG,pulled jade sword instead jade spear end life aaaaaaaaaaaaaaaaaaaaaaaaaaaaaaaaaaaaaaaaaaaaaaaaaaaaaaaaa  neg
1361051067987996672,2021-02-14 20:33:56+00:00,not mentally prepared for a 6am alarm tomorrow after not working since end of december but my god i am ready for some routine and normality in my life 😅😅😅,mentally prepared  alarm tomorrow working end december god ready routine normality life    
1361050843051655174,2021-02-14 20:33:02+00:00,"Therapy saved my life , yeah yeah I now wanna end it again hahahahha 

*blank stares 

Uhh im gonna grab a beer 

*talking to self in kitchen 

Cmon man get it together rebound , we never get invited 

*walks back into room like a robot 

Sober life forms will be exterminated",therapy saved life   yeah yeah wanna end hahahahha    blank stare   uhh im gonna grab beer    talking self kitchen   cmon man rebound   invited    walk room like robot   sober life form exterminated
1361050748423872512,2021-02-14 20:32:40+00:00,"@Submaton i def understand not evn being able to get to a place of getting what u need to b able to heal bc iv bn there 4 most of my life, but at the same time i was also on the receiving end of (male/male-perceived) ppl who needed smth to take their internal struggles out on-", submaton def understand evn able place getting need able heal bc iv bn   life  time receiving end  male male perceived  ppl needed smth internal struggle 
1361050628294909957,2021-02-14 20:32:11+00:00,"could never keep a job, in &amp; out of psychiatric hospitals trying to deal with manic depression, schizophrenia, trauma &amp; addiction. times I wanted to end my life &amp; came close to where it was the only thing that consumed my mind daily. Just not wanting to be here anymore.",job   amp  psychiatric hospital trying deal manic depression  schizophrenia  trauma  amp  addiction  time wanted end life  amp  came close thing consumed mind daily  wanting anymore 
1361050338191679488,2021-02-14 20:31:02+00:00,"During my cock surgery there were major complications, and I briefly died. I could see a light and a figure at the end, it was god. “Lord, are Everton a banter club” I asked “Yes, my child” he responded. After he said that my heart rate picked up. Craziest experience of my life",cock surgery major complication  briefly died  light figure end  god   lord  everton banter club  asked  yes  child  responded  said heart rate picked  craziest experience life
1361050216460353537,2021-02-14 20:30:33+00:00,"But every kiss and every breathless moment 
I'd do it all again
Trying to make it right but I know it'll all go wrong
I'd do it all again
'Cause I can't lie
I love you still, for all my life and I always will
Even though I know how the story ends
I'd do it all again",kiss breathless moment  d trying right know wrong d  cause lie love  life know story end d
1361049818764730370,2021-02-14 20:28:58+00:00,"@CFCKaz6 @Arrizabalager During my cock surgery there were major complications, and I briefly died. I could see a light and a figure at the end, it was god. “Lord, are Man united a banter club” I asked “Yes, my child” he responded.After he said that my heart rate picked up. Craziest experience of my life", cfckaz   arrizabalager cock surgery major complication  briefly died  light figure end  god   lord  man united banter club  asked  yes  child  responded said heart rate picked  craziest experience life
1361049596785545219,2021-02-14 20:28:05+00:00,"During my cock surgery there were major complications, and I briefly died. I could see a light and a figure at the end, it was god. “Lord, are Man united a banter club” I asked “Yes, my child” he responded.After he said that my heart rate picked up. Craziest experience of my life",cock surgery major complication  briefly died  light figure end  god   lord  man united banter club  asked  yes  child  responded said heart rate picked  craziest experience life
1361049514778451978,2021-02-14 20:27:46+00:00,Want this lockdown to end so I can get my life together.,want lockdown end life 
1361049217117126661,2021-02-14 20:26:35+00:00,"Day 407

It’s your smile that I saw first. It’s what I chose to see for times that shall never end. It’s what I want for the rest of my life.",day      smile saw  chose time shall end  want rest life 
1361049025609261056,2021-02-14 20:25:49+00:00,"L stops me and alerts me that she will need to ""consult"" about the comments I made, and that she may be compelled to order a welfare check. I can't believe that someone would threaten me with an interaction that could end my life, without even asking if I actually planned to die.",l stop alert need  consult  comment  compelled order welfare check  believe threaten interaction end life  asking actually planned die 
1361048231887728642,2021-02-14 20:22:40+00:00,"@helloannasophia @thesundaytimes That's only any good if companies can afford to shut down and furlough staff. At the moment my life consists of go to work, mingle with others, return home, have no freedoms and repeat. I have been an advocate for lockdown but it needs to end before the end of April.", helloannasophia  thesundaytimes good company afford shut furlough staff  moment life consists work  mingle  return home  freedom repeat  advocate lockdown need end end april 
1361048163210186755,2021-02-14 20:22:23+00:00,I have never seen so many relationships and baby reveals in my life lol all this fake love y’all will be single by the end of the week lmao 😂,seen relationship baby reveals life lol fake love single end week lmao  
1361047986676129792,2021-02-14 20:21:41+00:00,I might end my life. https://t.co/8aCIId0y6M,end life     aciid
1361047732673273862,2021-02-14 20:20:41+00:00,"@LauraTillyMoss I inadvertently end many of female MCs with the “ee” sound: Callie, Toury, Emmie, and Mary. I didn’t realize that the influence came from my life. My best friends’ names ALL end with that sound. It’s not a perquisite to my friendship but just happenstance.", lauratillymoss inadvertently end female mc  ee  sound  callie  toury  emmie  mary  didn realize influence came life  best friend  end sound  perquisite friendship happenstance 
1361047594756165632,2021-02-14 20:20:08+00:00,I just lost my glasses in the house but couldn’t see to find them without them on. The end result: I walked around with my prescription sunglasses on looking for them. I’ve never felt more like a mix of Velma and Will from The Inbetweeners in my life. 😎🙃 https://t.co/FOwPo6rZpG,lost glass house couldn find  end result  walked prescription sunglass looking  felt like mix velma inbetweeners life       fowpo rzpg
1361046928969011200,2021-02-14 20:17:29+00:00,"this is why lgbtqia education is so necessary, because all the cis people in my life don't know how to talk about anything gender related or transition related which either ends up with inappropriate questions or just crickets.",lgbtqia education necessary  ci people life know talk gender related transition related end inappropriate question cricket 
1361046851974217738,2021-02-14 20:17:11+00:00,"""I don't want to get to the end of my life and find that I lived just the length of it. I want to have lived the width of it as well."" --Diane Ackerman", want end life find lived length  want lived width     diane ackerman
1361046523056898049,2021-02-14 20:15:52+00:00,"Even if we can't be together in the end, I love that you are part of my life.",end  love life 
1361046153178083333,2021-02-14 20:14:24+00:00,Ugh please end my life. https://t.co/dhomMBBZVF,ugh end life    dhommbbzvf
1361046128704249861,2021-02-14 20:14:18+00:00,"I'm only 20 minutes into the first episode of @HBOMax's ""The Investigation"" and while I know how the true story it's based on ends, I have never been so stressed out by a ringtone in my life. https://t.co/4Rx4JHPx6t",   minute episode  hbomax  investigation  know true story based end  stressed ringtone life     rx jhpx
1361045688289755139,2021-02-14 20:12:33+00:00,"@Consumer34 ilove you 2

I just want to be happy for once. But every time something or someone good came in my life 7/10 they or it ends up hurting me", consumer   ilove    want happy  time good came life      end hurting
1361045544957747203,2021-02-14 20:11:59+00:00,I am now at the ‘if only you’d had kids you could have grandkids!’ stage of strangers judging my life. It never ends.  https://t.co/kg7hc2eZfA, d kid grandkids   stage stranger judging life  end     kg hc ezfa
1361045295333711872,2021-02-14 20:11:00+00:00,"@goal During my cock surgery there were major complications, and I briefly died. I could see a light and a figure at the end, it was god. “Lord, are Man united a banter club” I asked “Yes, my child” he responded.After he said that my heart rate picked up. Craziest experience of my life", goal cock surgery major complication  briefly died  light figure end  god   lord  man united banter club  asked  yes  child  responded said heart rate picked  craziest experience life
1361045266175053829,2021-02-14 20:10:53+00:00,"I'm going through a very difficult time in my life these days because of work! 
I hope these days ends as I wish it to end.",going difficult time life day work   hope day end wish end 
1361045097853378561,2021-02-14 20:10:12+00:00,"@NorthantsPC1337 Enjoy mate, my 7 days leave ends tomorrow ☹️ - I genuinely think this has been the quickest week of my life. 😳", northantspc     enjoy mate    day leave end tomorrow      genuinely think quickest week life   
1361045090635022340,2021-02-14 20:10:11+00:00,Fuck my life END of story,fuck life end story
1361044808316444672,2021-02-14 20:09:03+00:00,@murdoc_112_zA not doing too good...sorry for everything. I apologize for not playing better. Dont waste your time on me. I honestly just want to end my life, murdoc     za good   sorry  apologize playing better  dont waste time  honestly want end life
1361044691412779012,2021-02-14 20:08:36+00:00,"spent years of my life putting niggas on, only to be betrayed in the end.",spent year life putting nigga  betrayed end 
1361044538094100481,2021-02-14 20:07:59+00:00,I seriously just want my life to end today its not even cause of V-day or anything I just really fucking hate living at this point,seriously want life end today cause v day fucking hate living point
1361044496755130372,2021-02-14 20:07:49+00:00,"@_iwanttokms_ Really living up to your name pal

I have no desire to end my life or anything but i'm so unbelievably bored that I wouldn't mind if somebody tried to k!ll me",  iwanttokms  living pal  desire end life unbelievably bored wouldn mind somebody tried k
1361044036405121025,2021-02-14 20:05:59+00:00,"Will you end my pain?
Will you take my life?
Will you bleed me out?
Will you hang me out to dry?
Will you take my soul in the midnight rain?
While I'm falling apart
While I'm going

Broken - Lund",end pain  life  bleed  hang dry  soul midnight rain  falling apart going  broken   lund
1361043897779109888,2021-02-14 20:05:26+00:00,im gonna end my life if i pay for goodbye lenin and it sucks,im gonna end life pay goodbye lenin suck
1361043324354895874,2021-02-14 20:03:10+00:00,"If you say ""so true bestie"" to me I will end my life", true bestie  end life
